title,original_title,plot,url_thumbnail
The Brutalist,The Brutalist,"When a visionary architect and his wife flee post-war Europe in 1947 to rebuild their legacy and witness the birth of modern United States, their lives are changed forever by a mysterious, wealthy client.",https://m.media-amazon.com/images/M/MV5BM2U0MWRjZTMtMDVhNC00MzY4LTgwOTktZGQ2MDdiYTI4OWMxXkEyXkFqcGc@._V1_SX300.jpg
Bridget Jones : folle de lui,Bridget Jones: Mad About the Boy,"Bridget Jones navigates life as a widow and single mum with the help of her family, friends, and former lover, Daniel. Back to work and on the apps, she's pursued by a younger man and maybe - just maybe - her son's science teacher.",https://m.media-amazon.com/images/M/MV5BMDdlY2Y2ZWEtYjk4Mi00Yjg3LWFlM2MtMWI1ZjVlNGQ5NTNjXkEyXkFqcGc@._V1_SX300.jpg
Captain America: Brave New World,Captain America: Brave New World,"Sam Wilson, the new Captain America, finds himself in the middle of an international incident and must discover the motive behind a nefarious global plan.",https://m.media-amazon.com/images/M/MV5BNDRjY2E0ZmEtN2QwNi00NTEwLWI3MWItODNkMGYwYWFjNGE0XkEyXkFqcGc@._V1_SX300.jpg
Le Dernier souffle,Le Dernier souffle,A Montreal police officer goes to Arkansas to solve the murder of his brother.,https://m.media-amazon.com/images/M/MV5BM2RmZjU4YmMtZmIxZi00OGYzLWI1MTMtYWZmNThhZjhmMThjXkEyXkFqcGdeQXVyNTA1NDY3NzY@._V1_SX300.jpg
Le Mohican,Le Mohican,"En plein cœur de l’été, Joseph, l’un des derniers bergers du littoral corse, voit son terrain convoité par le milieu pour un projet immobilier. Il refuse de céder. Cela signerait l",https://fr.web.img2.acsta.net/c_310_420/img/72/ab/72abbc296e18a1e605ff6a891832fa9a.jpg
Hola Frida,Hola Frida,"C’est l’histoire d’une petite fille différente. Son monde, c’est Coyoacan au Mexique. Pétillante, vibrante, tout l’intéresse. Et lorsque les épreuves se présentent, elle leur fait ",https://fr.web.img3.acsta.net/c_310_420/img/b8/8a/b88af4a1cfcf0df8e8a53cb6ce25055b.jpg
Prima la vita,Il tempo che si vuole,"Un père et sa fille habitent les mondes de l’enfance. Il lui parle avec respect et sérieux, comme à une grande personne, il l’entraine dans des univers magiques débordants de vie e",https://fr.web.img6.acsta.net/c_310_420/img/a8/c8/a8c89e4ef25dafa5e73b341033e79fe6.jpg
Daffy et Porky sauvent le monde,The Day the Earth Blew Up: A Looney Tunes Movie,"L’un des plus grands duos comiques de l’Histoire, Daffy Duck et Porky Pig, fait son grand retour au cinéma dans une nouvelle comédie déjantée. Enchaînant les gags et les catastroph",https://fr.web.img5.acsta.net/c_310_420/img/cc/e6/cce60e5926b977c7266cd461a63f3c79.jpg
"La Vie, en gros",Zivot k sezrání,C’est la rentrée. Ben trouve que ses camarades ont changé. Il aimerait que Claire s’intéresse à lui mais son poids le complexe. Cette année scolaire les fera tous grandir et compre,https://fr.web.img6.acsta.net/c_310_420/img/a7/02/a702df5e0997a7285f8e518c8a62dcc4.jpg
