title,original_title,date,duration,categories,countries,star_rating,notes,reviews,directors,actors,composers,summary,url_thumbnail,url_reviews,url_similar_movies
Resistance,Resistance,25 novembre 2020,2h 02min,"Biopic,Drame,Historique","France,Allemagne,U.S.A.,Grande-Bretagne","3,8",824,57,Jonathan Jakubowicz,"Jesse Eisenberg,Ed Harris,Clémence Poésy,Félix Moati,Matthias Schweighöfer,Édgar Ramírez,Karl Markovics,Bella Ramsey,Géza Röhrig,Wolfgang Czeczor,Alicia von Rittberg,Vica Kerekes,Arndt Schwering-Sohnrey,Philip Lenkowsky",Angelo Milli,"Durant la Seconde Guerre mondiale, en 1942, Marcel Mangel s'engage, sous le nom de Marcel Marceau, dans la Résistance française, sous l'influence de son frère Simon et de son cousi",https://fr.web.img4.acsta.net/c_310_420/pictures/20/03/03/09/07/2234276.jpg,https://www.allocine.fr/film/fichefilm-74720/critiques/spectateurs/,https://www.allocine.fr/film/fichefilm-74720/similaire/
La Bonne épouse,La Bonne épouse,11 mars 2020,1h 49min,Comédie,"France,Belgique","2,6",4546,337,Martin Provost,"Juliette Binoche,Yolande Moreau,Noémie Lvovsky,Edouard Baer,François Berléand,Marie Zabukovec,Anamaria Vartolomei,Lily Taïeb,Pauline Briand,Armelle",Grégoire Hetzel,Tenir son foyer et se plier au devoir conjugal sans moufter : c’est ce qu’enseigne avec ardeur Paulette Van Der Beck dans son école ménagère. Ses certitudes vacillent quand elle se,https://fr.web.img2.acsta.net/c_310_420/pictures/20/02/25/13/59/4714957.jpg,https://www.allocine.fr/film/fichefilm-271733/critiques/spectateurs/,https://www.allocine.fr/film/fichefilm-271733/similaire/
King,King,16 février 2022,1h 45min,"Aventure,Famille",France,"2,6",676,132,David Moreau,"Gérard Darmon,Lou Lambrecht,Léo Lorléac'h,Thibault de Montalembert,Clémentine Baert,Artus,Marius Blivet,Laurent Bateau,Laurence Facelina,Vanessa David,Marie-Sohna Condé,Véronique Boulanger,Maxime Jullia,Alexandre Brik,Séverine Warneys,Pierre Léon Luneau",Guillaume Roussel,"King, un lionceau destiné à un trafic, s'échappe de l'aéroport et se réfugie dans la maison d'Inès, 12 ans et Alex, 15. Le frère et la sœur ont alors l'idée folle de le ramener che",https://fr.web.img2.acsta.net/c_310_420/pictures/22/01/14/11/08/3279706.jpg,https://www.allocine.fr/film/fichefilm-286346/critiques/spectateurs/,https://www.allocine.fr/film/fichefilm-286346/similaire/
Joyeuse retraite !,Joyeuse retraite !,20 novembre 2019,1h 37min,Comédie,France,"2,1",4908,351,Fabrice Bracq,"Thierry Lhermitte,Michèle Laroque,Nicole Ferroni,Judith Magre,Constance Labbé,Omar Mebrouk,Nicolas Martinez,Gérémy Crédeville,Arièle Séménoff,Alain Doutey,Bernard Yerlès",Adrien Bekerman,"L’heure de la retraite est enfin arrivée pour Philippe et Marilou ! Ils s’apprêtent à réaliser leur rêve : partir vivre sous le soleil du Portugal. Au revoir le travail, au revoir ",https://fr.web.img6.acsta.net/c_310_420/pictures/19/08/08/13/40/0488542.jpg,https://www.allocine.fr/film/fichefilm-268345/critiques/spectateurs/,https://www.allocine.fr/film/fichefilm-268345/similaire/
La Nuée,La Nuée,16 juin 2021,1h 41min,"Drame,Epouvante-horreur",France,"3,1",3359,255,Just Philippot,"Suliane Brahim,Sofian Khammes,Marie Narbonne,Raphaël Romand,Victor Bonnel,Vincent Deniard,Stephan Castang,Guillaume Bursztyn,Christian Bouillette,Clément Bertani",Vincent Cahay,Le film fait partie de la Sélection Semaine de la Critique Cannes 2020,https://fr.web.img5.acsta.net/c_310_420/pictures/20/09/30/08/58/1424401.jpg,https://www.allocine.fr/film/fichefilm-273912/critiques/spectateurs/,https://www.allocine.fr/film/fichefilm-273912/similaire/
Love And Monsters,Love And Monsters,16 octobre 2020,1h 49min,"Aventure,Comédie,Science Fiction",U.S.A.,"3,3",5457,208,Michael Matthews,"Dylan O'Brien,Jessica Henwick,Michael Rooker,Dan Ewing,Ariana Greenblatt,Ellen Hollman,Pacharo Mzembe,Amali Golden,Te Kohe Tuhaka,Tasneem Roc,Thomas Campbell,Melanie Zanetti,Larry Cedar,Damien Garvey","Marco Beltrami,Marcus Trumpp",Un jeune homme tente de survivre dans un monde post-apocalyptique envahi par des monstres. Un expert lui enseigne comment les combattre...,https://fr.web.img6.acsta.net/c_310_420/pictures/21/04/21/10/33/5133459.jpg,https://www.allocine.fr/film/fichefilm-209011/critiques/spectateurs/,https://www.allocine.fr/film/fichefilm-209011/similaire/
Lui,Lui,27 octobre 2021,1h 28min,"Drame,Thriller",France,"1,7",1185,209,Guillaume Canet,"Guillaume Canet,Virginie Efira,Mathieu Kassovitz,Laetitia Casta,Nathalie Baye,Patrick Chesnais,Gilles Cohen",Alexandre Desplat,"Un compositeur en mal d’inspiration, qui vient de quitter femme et enfants, pense trouver refuge dans une vieille maison à flanc de falaise, sur une île bretonne déserte. Dans ce l",https://fr.web.img2.acsta.net/c_310_420/pictures/21/08/30/10/07/0427931.jpg,https://www.allocine.fr/film/fichefilm-286347/critiques/spectateurs/,https://www.allocine.fr/film/fichefilm-286347/similaire/
Haute couture,Haute couture,10 novembre 2021,1h 41min,"Comédie,Comédie dramatique,Drame",France,"2,9",1929,133,Sylvie Ohayon,"Nathalie Baye,Lyna Khoudri,Pascale Arbillot,Claude Perron,Adam Bessa,Alexandrina Turcan,Soumaye Bocoum,Romain Brau,Clotilde Courau,Virgile Bramly,Claudine Vincent,Farida Ouchani,Saïd Benchnafa,Sandra Choquet,Luigi Kröner,Benjamin Gauthier",Pascal Lengagne,"Première d’atelier au sein de la Maison Dior, Esther participe à sa dernière collection de Haute Couture avant de prendre sa retraite. Un jour, elle se fait voler son sac dans le m",https://fr.web.img5.acsta.net/c_310_420/pictures/21/09/30/10/16/2156149.jpg,https://www.allocine.fr/film/fichefilm-278695/critiques/spectateurs/,https://www.allocine.fr/film/fichefilm-278695/similaire/
L'école du bout du monde,Lunana: A Yak in the Classroom,11 mai 2022,1h 49min,"Aventure,Drame,Famille",Bhoutan,"4,2",1004,89,Pawo Choyning Dorji,"Sherab Dorji,Ugyen Norbu Lhendup,Kelden Lhamo Gurung,Pem Zam,Tshering Dorji",,"Un jeune instituteur du Bhoutan est envoyé dans la partie la plus reculée du pays. Loin de la ville, le quotidien est rude, mais la force spirituelle des habitants du village trans",https://fr.web.img3.acsta.net/c_310_420/pictures/22/02/09/15/55/2712297.jpg,https://www.allocine.fr/film/fichefilm-279377/critiques/spectateurs/,https://www.allocine.fr/film/fichefilm-279377/similaire/
J’y crois encore,I Still Believe,4 juin 2020,1h 55min,"Biopic,Drame,Musical,Romance",U.S.A.,"3,2",423,47,"Andrew Erwin,Jon Erwin","K.J. Apa,Britt Robertson,Nathan Parsons,Abigail Cowen,Shania Twain,Gary Sinise,Melissa Roxburgh,Tanya Christiansen,Terry Serpico,Nicolas Bechtel,Cameron Arnett",John Debney,"Jeremy et Melissa filent le parfait amour lorsqu’ils apprennent qu'elle est atteinte d’une maladie incurable. Malgré l'incompréhension de leurs proches, ils décident de se marier e",https://fr.web.img2.acsta.net/c_310_420/pictures/20/04/01/14/59/3113149.jpg,https://www.allocine.fr/film/fichefilm-271592/critiques/spectateurs/,https://www.allocine.fr/film/fichefilm-271592/similaire/
J'adore ce que vous faites,J'adore ce que vous faites,18 mai 2022,1h 31min,Comédie,France,"2,4",1609,160,Philippe Guillard,"Gérard Lanvin,Artus,Antoine Bertrand,Laura del Sol,Natasha Andrews,Caroline Bourg,Lou Chauvain,Louis Seillé,Antony Hickling,Fabienne Galula,Patrick Lapeyrie,Robbie Nock,Thierry Calas,Eric Wagner,Anthony Hill,Anne-Juliette Vassort",,"Alors que Gérard Lanvin s’apprête à tourner l’un des films les plus importants de sa carrière dans le sud de la France, son chemin croise celui de Momo Zapareto… Pour son plus gran",https://fr.web.img3.acsta.net/c_310_420/pictures/22/03/03/12/21/4555998.jpg,https://www.allocine.fr/film/fichefilm-286044/critiques/spectateurs/,https://www.allocine.fr/film/fichefilm-286044/similaire/
L'incroyable histoire de l'Île de la Rose,L'incredibile storia dell'isola delle rose,9 décembre 2020,1h 58min,"Comédie,Drame",Italie,"3,6",919,51,Sydney Sibilia,"Elio Germano,Matilda De Angelis,Tom Wlaschiha,Luca Zingaretti,Fabrizio Bentivoglio,Leonardo Lidi,François Cluzet,Ascanio Balbo,Andrea Pennacchi,Fabrizio Rongione,Christian Stamm,Marco Pancrazi,Federico Pacifici",Michele Braga,"L'histoire de ‘L'île de la Rose’, une plate-forme construite de toute pièce par l'ingénieur Giorgio Rosa en 1968 au large de la côte Italienne en dehors des eaux territoriales qui ",https://fr.web.img6.acsta.net/c_310_420/pictures/20/11/02/12/24/1133501.jpg,https://www.allocine.fr/film/fichefilm-283679/critiques/spectateurs/,https://www.allocine.fr/film/fichefilm-283679/similaire/
No Sudden Move,No Sudden Move,8 septembre 2021,1h 56min,"Policier,Drame,Thriller",U.S.A.,"2,9",486,45,Steven Soderbergh,"Don Cheadle,Brendan Fraser,Benicio Del Toro,Julia Fox,Kieran Culkin,Craig Grant,Amy Seimetz,David Harbour,Noah Jupe,Frankie Shaw,Jon Hamm,Ray Liotta,Wallace Bridges,Hugh Maguire,Byron Bowers,Bill Duke,Patrick Cronin,Matt Damon",David Holmes,"Detroit, au milieu des années 1950. Des criminels de divers horizons se réunissent et doivent collaborer afin de découvrir pourquoi ils ont été mis à l’écart.",https://fr.web.img6.acsta.net/c_310_420/pictures/21/06/08/09/55/1053922.jpg,https://www.allocine.fr/film/fichefilm-279217/critiques/spectateurs/,https://www.allocine.fr/film/fichefilm-279217/similaire/
Follow Me,Follow Me,3 janvier 2021,1h 32min,"Epouvante-horreur,Thriller",U.S.A.,"2,1",301,47,Will Wernick,"Keegan Allen,Holland Roden,Denzel Whitaker,Ronen Rubinstein,Pavel Lychnikoff,Kimberly Quinn,Emilia Ares,Ravil Isyanov,Dimiter D. Marinov,Emily Hinkler,Elizabeth Hinkler,Daniyar,Dominic Pace,Andrei Runtso",,"Obsédé par son image, Cole Turner est une vedette des réseaux sociaux dont les fans suivent les moindres faits et gestes à travers les vidéos et les images qu'il poste sans cesse s",https://fr.web.img6.acsta.net/c_310_420/commons/v9/common/empty/empty_portrait.png,https://www.allocine.fr/film/fichefilm-267774/critiques/spectateurs/,https://www.allocine.fr/film/fichefilm-267774/similaire/
Les Nouveaux mutants,The New Mutants,26 août 2020,1h 33min,"Fantastique,Epouvante-horreur,Science Fiction,Thriller",U.S.A.,"2,1",5480,362,Josh Boone,"Maisie Williams,Anya Taylor-Joy,Charlie Heaton,Henrique Zaga,Blu Hunt,Alice Braga,Happy Anderson,Thomas Kee",Mark Snow,"Rahne Sinclair, Illyana Rasputin, Sam Guthrie et Roberto da Costa sont quatre jeunes mutants retenus dans un hôpital isolé pour suivi psychiatrique. Le Dr Cecilia Reyes, qui estime",https://fr.web.img6.acsta.net/c_310_420/pictures/20/08/12/15/17/5486144.jpg,https://www.allocine.fr/film/fichefilm-237864/critiques/spectateurs/,https://www.allocine.fr/film/fichefilm-237864/similaire/
Rouge,Rouge,11 août 2021,1h 26min,Thriller,"France,Belgique","3,5",1874,109,Farid Bentoumi,"Zita Hanrot,Sami Bouajila,Céline Sallette,Olivier Gourmet,Thierry Rousset,Henri-Noël Tabary,Alka Balbir,Josiane Vermare,Yannick Rosset,Thierry Simon,Antonia Buresi,Matthieu Loos,Vanessa Desmaret,Driss Ramdi",Pierre Desprats,"Nour vient d’être embauchée comme infirmière dans l’usine chimique où travaille son père, délégué syndical et pivot de l’entreprise depuis toujours.",https://fr.web.img2.acsta.net/c_310_420/pictures/20/10/02/11/44/2165670.jpg,https://www.allocine.fr/film/fichefilm-283729/critiques/spectateurs/,https://www.allocine.fr/film/fichefilm-283729/similaire/
C'est magnifique !,C'est magnifique !,1 juin 2022,1h 37min,"Comédie,Fantastique",France,"3,4",1531,291,Clovis Cornillac,"Clovis Cornillac,Alice Pol,Manon Lemoine,Myriam Boyer,Gilles Privat,Alexandra Roth,Lilou Fogli,Laurent Bateau,Olivier Bouana,André Penvern,Boris Terral,Anne Benoit,Evelyne Cervera,Alain Blazquez,Dany Benedito,Nicole Biondi,Antoine Croset,Roger Cornillac,Pierre Cognon,Nicolas Fine,Stéphane Margot,Matthieu Loos,Brigitte Chambon,Yvette Ferreol",Guillaume Roussel,"Pierre, la quarantaine, a toujours vécu loin des désordres du monde, entre ses abeilles et ses hibiscus. Lorsque ses parents disparaissent, c’est tout son univers qui bascule : il ",https://fr.web.img5.acsta.net/c_310_420/pictures/21/08/05/12/35/2660259.jpg,https://www.allocine.fr/film/fichefilm-275805/critiques/spectateurs/,https://www.allocine.fr/film/fichefilm-275805/similaire/
Teddy,Teddy,30 juin 2021,1h 28min,"Comédie,Fantastique,Epouvante-horreur",France,"3,0",1270,94,"Ludovic Boukherma,Zoran Boukherma","Anthony Bajon,Christine Gautier,Ludovic Torrent,Guillaume Mattera,Noémie Lvovsky,Jean-Paul Fabre,Jean-Michel Ricart",Amaury Chabauty,Le film fait partie de la Sélection Officielle Cannes 2020,https://fr.web.img6.acsta.net/c_310_420/pictures/21/07/05/13/09/5598862.jpg,https://www.allocine.fr/film/fichefilm-277071/critiques/spectateurs/,https://www.allocine.fr/film/fichefilm-277071/similaire/
La Bataille de l'Escaut,De slag om de Schelde,15 octobre 2021,2h 04min,"Drame,Guerre",Pays-Bas,"3,7",850,67,Matthijs van Heijningen Jr.,"Gijs Blom,Jamie Flatters,Susan Radder,Jan Bijvoet,Tom Felton,Theo Barklem-Biggs,Scott Reid,Marthe Schneider,Justus von Dohnányi,Pit Bukowski,Dylan Smith,Mark van Eeuwen,Mathijs Scheepers,Maximilian Beck",Emilie Levienaise-Farrouch,"Au cours de la bataille de l'Escaut, les vies d'un pilote de planeur, d'un soldat nazi et d'une recrue réticente de la Résistance se croisent tragiquement.",https://fr.web.img6.acsta.net/c_310_420/pictures/21/10/06/15/28/1435725.jpg,https://www.allocine.fr/film/fichefilm-283570/critiques/spectateurs/,https://www.allocine.fr/film/fichefilm-283570/similaire/
Rupture fatale,A Fall from Grace,26 juin 2020,2h 00min,Thriller,U.S.A.,"3,0",2162,122,Tyler Perry,"Crystal Fox,Phylicia Rashad,Bresha Webb,Cicely Tyson,Tyler Perry,Mehcad Brooks",,Une femme divorcée entame une nouvelle relation amoureuse. L'euphorie ne dure pas très longtemps car rapidement elle découvre des sombres secrets sur son compagnon...,https://fr.web.img2.acsta.net/c_310_420/pictures/20/01/06/08/08/3717977.jpg,https://www.allocine.fr/film/fichefilm-279318/critiques/spectateurs/,https://www.allocine.fr/film/fichefilm-279318/similaire/
Mank,Mank,4 décembre 2020,2h 12min,"Biopic,Drame",U.S.A.,"3,4",1454,126,David Fincher,"Gary Oldman,Amanda Seyfried,Lily Collins,Tom Pelphrey,Arliss Howard,Tuppence Middleton,Monika Gossmann,Joseph Cross,Sam Troughton,Toby Leonard Moore,Tom Burke,Charles Dance,Ferdinand Kingsley,Jamie McShane,Adam Shapiro,John Churchill,Sean Persaud,Paul Fox (II),Tom Simmons","Trent Reznor,Atticus Ross","Dans ce film qui jette un point de vue caustique sur le Hollywood des années 30, le scénariste Herman J. Mankiewicz, alcoolique invétéré au regard acerbe, tente de boucler à temps ",https://fr.web.img6.acsta.net/c_310_420/pictures/20/10/21/09/03/0563347.jpg,https://www.allocine.fr/film/fichefilm-275554/critiques/spectateurs/,https://www.allocine.fr/film/fichefilm-275554/similaire/
Riders of Justice,Retfærdighedens Ryttere,10 septembre 2021,1h 51min,"Action,Comédie,Thriller",Danemark,"3,9",1083,93,Anders Thomas Jensen,"Mads Mikkelsen,Nikolaj Lie Kaas,Andrea Heick Gadeberg,Lars Brygmann,Nicolas Bro,Gustav Lindh,Roland Møller,Jacob Lohmann,Albert Rudbeck Lindhardt,Henrik Noél Olesen,Gustav Dyekjaer Giese,Omar Shargawi,Morten Suurballe,Rikke Louise Andersson",Jeppe Kaas,"Markus, militaire danois en poste en Afghanistan, rentre précipitamment chez lui après la mort de son épouse dans un accident de métro pour s'occuper de leur fille. Un rescapé, Ott",https://fr.web.img3.acsta.net/c_310_420/pictures/21/04/16/12/10/5635732.jpg,https://www.allocine.fr/film/fichefilm-280446/critiques/spectateurs/,https://www.allocine.fr/film/fichefilm-280446/similaire/
Irrémédiable,El practicante,21 septembre 2020,1h 34min,"Drame,Thriller",Espagne,"2,6",502,54,Carles Torras,"Mario Casas,Déborah François,Guillermo Pfening,Celso Bugallo,Raul Jiménez,Maria Rodríguez Soto,Pol Monen",,"Condamné à vivre en fauteuil après un accident, Ángel décide de se venger de ceux qui l'ont trahi, en particulier de la femme qui l'a quitté au pire moment.",https://fr.web.img6.acsta.net/c_310_420/pictures/20/08/25/14/40/2556861.jpg,https://www.allocine.fr/film/fichefilm-278142/critiques/spectateurs/,https://www.allocine.fr/film/fichefilm-278142/similaire/
Seize Printemps,Seize Printemps,16 juin 2021,1h 14min,"Drame,Romance",France,"1,3",1122,100,Suzanne Lindon,"Suzanne Lindon,Arnaud Valois,Florence Viala,Frédéric Pierrot,Rebecca Marder,Arthur Giusi,Françoise Widhoff,Raymond Aquaviva,Dominique Besnehard,Philippe Uchan",Vincent Delerm,Le film fait partie de la Sélection Officielle de Cannes 2020.,https://fr.web.img6.acsta.net/c_310_420/pictures/20/12/08/10/01/4425187.jpg,https://www.allocine.fr/film/fichefilm-283733/critiques/spectateurs/,https://www.allocine.fr/film/fichefilm-283733/similaire/
Minari,Minari,23 juin 2021,1h 56min,Drame,U.S.A.,"3,6",1888,83,Lee Isaac Chung,"Steven Yeun,Ye-Ri Han,Alan S. Kim,Noel Kate Cho,Yuh-Jung Youn,Will Patton,Scott Haze,Warren Lane,Laurie Cummings,Kaye Brownlee-France,Tina Parker,Jenny Phagan,Darryl Cox,Eric Starkey",Emile Mosseri,Une famille américaine d’origine sud-coréenne s’installe dans l’Arkansas où le père de famille veut devenir fermier. Son petit garçon devra s’habituer à cette nouvelle vie et à la ,https://fr.web.img6.acsta.net/c_310_420/pictures/21/06/08/16/17/3217700.jpg,https://www.allocine.fr/film/fichefilm-275596/critiques/spectateurs/,https://www.allocine.fr/film/fichefilm-275596/similaire/
Nitram,Nitram,11 mai 2022,1h 50min,"Drame,Thriller",Australie,"3,5",554,60,Justin Kurzel,"Caleb Landry Jones,Essie Davis,Judy Davis,Anthony LaPaglia,Phoebe Taylor,Sean Keenan,Conrad Brandt,Jessie Ward",Jed Kurzel,"En Australie dans le milieu des années 90, Nitram vit chez ses parents, où le temps s’écoule entre solitude et frustration. Alors qu'il propose ses services comme jardinier, il ren",https://fr.web.img6.acsta.net/c_310_420/pictures/22/02/24/10/57/1760581.jpg,https://www.allocine.fr/film/fichefilm-288592/critiques/spectateurs/,https://www.allocine.fr/film/fichefilm-288592/similaire/
"C'est nous, les héros",We Can Be Heroes,25 décembre 2020,1h 40min,"Action,Aventure,Comédie,Famille,Fantastique,Science Fiction",U.S.A.,"1,7",360,43,Robert Rodriguez,"YaYa Gosselin,Adriana Barraza,Boyd Holbrook,Christian Slater,Sung Kang,Christopher McDonald,Pedro Pascal,Priyanka Chopra Jonas,Andy Walken,Hala Finley,Akira Akbar,Vivien Lyra Blair,Taylor Dooley,J.J. Dashnaw,Brittany Perry-Russell,J. Quinton Johnson",Rebel Rodriguez,"Lorsque des envahisseurs extraterrestres kidnappent les super-héros de notre planète, leurs enfants doivent s'unir et apprendre à fonctionner en équipe pour sauver leurs parents et",https://fr.web.img6.acsta.net/c_310_420/pictures/20/12/04/17/21/2904353.jpg,https://www.allocine.fr/film/fichefilm-276644/critiques/spectateurs/,https://www.allocine.fr/film/fichefilm-276644/similaire/
Tous nos jours parfaits,All the Bright Places,10 avril 2020,1h 47min,"Drame,Romance",U.S.A.,"3,6",945,62,Brett Haley,"Elle Fanning,Justice Smith,Keegan-Michael Key,Alexandra Shipp,Luke Wilson,Virginia Gardner,Lamar Johnson,Felix Mallard,Kelli O'Hara,Nicole Forester",Keegan DeWitt,Deux adolescents suicidaires se rencontrent et réapprennent à aimer la vie.,https://fr.web.img3.acsta.net/c_310_420/pictures/20/02/07/09/27/1987472.jpg,https://www.allocine.fr/film/fichefilm-239793/critiques/spectateurs/,https://www.allocine.fr/film/fichefilm-239793/similaire/
Demon Slayer - Kimetsu no Yaiba - Le film : Le train de l'infini,Kimetsu no Yaiba: Mugen Ressha-Hen,19 mai 2021,1h 57min,"Action,Animation,Fantastique",Japon,"4,0",4079,180,Haruo Sotozaki,,,"Le groupe de Tanjirô a terminé son entraînement de récupération au domaine des papillons et embarque à présent en vue de sa prochaine mission à bord du train de l'infini, d'où quar",https://fr.web.img5.acsta.net/c_310_420/pictures/21/09/27/11/50/4294280.jpg,https://www.allocine.fr/film/fichefilm-272355/critiques/spectateurs/,https://www.allocine.fr/film/fichefilm-272355/similaire/
Mon Cousin,Mon Cousin,30 septembre 2020,1h 44min,Comédie,"France,Belgique","2,4",2799,221,Jan Kounen,"Vincent Lindon,François Damiens,Pascale Arbillot,Alix Poisson,Olivia Gotanegre,Lumina Wang,Hadriel Roure,Pierre Gommé,Capucine Valmary,Séverine Vasselin,Dominique Bettenfeld,Catherine Davenier,Jean Reynès,Albert Dupontel,Anne Benoit,Caroline Gay",,"Pierre est le PDG accompli d’un grand groupe familial. Sur le point de signer l’affaire du siècle, il doit régler une dernière formalité : la signature de son cousin Adrien qui dét",https://fr.web.img4.acsta.net/c_310_420/pictures/20/03/06/11/02/5046332.jpg,https://www.allocine.fr/film/fichefilm-271832/critiques/spectateurs/,https://www.allocine.fr/film/fichefilm-271832/similaire/
Un vrai bonhomme,Un vrai bonhomme,8 janvier 2020,1h 28min,Comédie dramatique,France,"3,9",1217,105,Benjamin Parent,"Thomas Guy,Benjamin Voisin,Isabelle Carré,Laurent Lucas,Anaëlle Othenin-Girard,Tasnim Jamlaoui,Guillaume Arnault,Mohamed Seddiki,Sami Outalbali,Léa Rostain,Mahia Zrouki,Eric Boucher,Joséphine Draï,Pierre Bénézit,Bruno Sanches,Delphine Baril,Andranic Manet",Pierre Lefeuvre,"Tom, un adolescent timide et sensible, s’apprête à faire sa rentrée dans un nouveau lycée.",https://fr.web.img3.acsta.net/c_310_420/pictures/19/11/26/15/12/1664513.jpg,https://www.allocine.fr/film/fichefilm-266257/critiques/spectateurs/,https://www.allocine.fr/film/fichefilm-266257/similaire/
La Daronne,La Daronne,9 septembre 2020,1h 46min,"Comédie,Policier,Drame",France,"3,0",4388,279,Jean-Paul Salomé,"Isabelle Huppert,Hippolyte Girardot,Liliane Rovère,Iris Bry,Rebecca Marder,Farida Ouchani,Jade-Nadja Nguyen,Rachid Guellaz,Mourad Boudaoud,Youssef Sahraoui,Yann Sundberg,Raphaël Quenard",Bruno Coulais,"Patience Portefeux est interprète judiciaire franco-arabe, spécialisée dans les écoutes téléphoniques pour la brigade des Stups. Lors d'une enquête, elle découvre que l'un des traf",https://fr.web.img5.acsta.net/c_310_420/pictures/19/12/11/09/17/0499690.jpg,https://www.allocine.fr/film/fichefilm-268644/critiques/spectateurs/,https://www.allocine.fr/film/fichefilm-268644/similaire/
Josep,Josep,30 septembre 2020,1h 11min,"Animation,Biopic,Drame,Historique","France,Espagne,Belgique","3,7",2113,91,,,,Le film fait partie de la Sélection Officielle Cannes 2020.,https://fr.web.img3.acsta.net/c_310_420/pictures/21/05/12/10/00/4510528.jpg,https://www.allocine.fr/film/fichefilm-268348/critiques/spectateurs/,https://www.allocine.fr/film/fichefilm-268348/similaire/
Project Power,Project Power,15 août 2020,1h 51min,"Action,Science Fiction,Thriller",U.S.A.,"2,8",1883,123,"Henry Joost,Ariel Schulman","Jamie Foxx,Joseph Gordon-Levitt,Dominique Fishback,Rodrigo Santoro,Machine Gun Kelly,Amy Landecker,Courtney B. Vance,Tait Fletcher,Yoshi Sudarso,Joseph Poliquin,Allen Maldonado,Jim Klock,Azhar Khan,Andrene Ward-Hammond,Kyanna Simone Simpson,Mike Seal,Rose Bianco,Chip Carriere,Luke Hawx",,Qu'êtes-vous prêt à risquer pour cinq minutes de pouvoirs extraordinaires ?,https://fr.web.img4.acsta.net/c_310_420/pictures/20/07/15/17/25/0296135.jpg,https://www.allocine.fr/film/fichefilm-268042/critiques/spectateurs/,https://www.allocine.fr/film/fichefilm-268042/similaire/
First Cow,First Cow,9 juillet 2021,2h 02min,"Drame,Western",U.S.A.,"3,9",1105,87,Kelly Reichardt,"John Magaro,Orion Lee,Toby Jones,Ewen Bremner,Scott Shepherd (II),Gary Farmer,Lily Gladstone,Jared Kasowski,Alia Shawkat,Rene Auberjonois,Dylan Smith,Clayton Nemrow,Manuel Rodriguez,John Keating (II)",William Tyler,"Au début du XIXe siècle, sur les terres encore sauvages de l’Oregon, Cookie Figowitz, un humble cuisinier, se lie d’amitié avec King-Lu, un immigrant d’origine chinoise. Rêvant tou",https://fr.web.img4.acsta.net/c_310_420/pictures/21/09/28/10/13/2837582.jpg,https://www.allocine.fr/film/fichefilm-269258/critiques/spectateurs/,https://www.allocine.fr/film/fichefilm-269258/similaire/
De l'autre côté du ciel,Eiga Entotsumachi no Puperu,17 août 2022,1h 40min,"Animation,Fantastique",Japon,"3,9",691,62,,,,"Lubicchi vit au milieu de grandes cheminées dont l’épaisse fumée recouvre depuis toujours le ciel de sa ville. Il aimerait prouver à tous que son père disait vrai et que, par-delà ",https://fr.web.img4.acsta.net/c_310_420/pictures/22/03/17/16/32/4087004.jpg,https://www.allocine.fr/film/fichefilm-292926/critiques/spectateurs/,https://www.allocine.fr/film/fichefilm-292926/similaire/
Lucky Strike,Beasts Clawing at Straws,8 juillet 2020,1h 48min,"Drame,Thriller",Corée du Sud,"3,6",2267,125,Yong-hoon Kim,"Do-Yeon Jeon,Woo-Sung Jung,Seong-woo Bae,Yuh-Jung Youn,Man-Sik Jeong,Hyon-Bin Shin,Ga-ram Jung,Ji-hwan Park,Kyung Jin,Dong-won Heo",Nene Kang,"Un corps retrouvé sur une plage, un employé de sauna, un douanier peu scrupuleux, un prêteur sur gage et une hôtesse de bar qui n’auraient jamais dû se croiser. Mais le sort en a d",https://fr.web.img6.acsta.net/c_310_420/pictures/20/06/15/10/57/2331896.jpg,https://www.allocine.fr/film/fichefilm-282031/critiques/spectateurs/,https://www.allocine.fr/film/fichefilm-282031/similaire/
Le Test,Le Test,29 décembre 2021,1h 19min,"Comédie,Famille",France,"3,0",2447,208,Emmanuel Poulain-Arnaud,"Alexandra Lamy,Philippe Katerine,Matteo Perez,Joaquim Fossi,Chloé Barkoff-Gaillard,Pablo Cobo,Lucile Jaillant,Louvia Bachelier,Anaïs Fabre,Stephan Wojtowicz,Maëlis Adalle,Valérie Crouzet,Audrey Perrin",Julien Glabs,"Annie Castillon est heureuse. Sa vie conjugale avec Laurent est un exemple d’harmonie. Ses deux grands, Maximilien et César sont des garçons brillants et sensibles. Et Poupi, sa je",https://fr.web.img2.acsta.net/c_310_420/pictures/21/10/07/16/24/2854605.jpg,https://www.allocine.fr/film/fichefilm-286712/critiques/spectateurs/,https://www.allocine.fr/film/fichefilm-286712/similaire/
