title,original_title,date,duration,categories,countries,star_rating,notes,reviews,directors,actors,composers,summary,url_thumbnail,url_reviews,url_similar_movies
Glass,Glass,16 janvier 2019,2h 10min,"Fantastique,Thriller",U.S.A.,"3,5",10539,730,M. Night Shyamalan,"James McAvoy,Bruce Willis,Anya Taylor-Joy,Sarah Paulson,Samuel L. Jackson,Charlayne Woodard,Spencer Treat Clark,Luke Kirby,Adam David Thompson,Marisa Brown,Rob Yang,Jane Park Smith,Diana Silvers,Jennifer Butler,Gary Ayash,Brian Donahue,Jon Douglas Rainey,Jeffrey Mowery,Michael J. Kraycik,Giuseppe Ardizzone",West Dylan Thordson,"Peu de temps après les événements relatés dans Split, David Dunn - l’homme incassable - poursuit sa traque de La Bête, surnom donné à Kevin Crumb depuis qu’on le sait capable d’end",https://fr.web.img6.acsta.net/c_310_420/pictures/19/01/15/12/29/5059914.jpg,https://www.allocine.fr/film/fichefilm-253849/critiques/spectateurs/,https://www.allocine.fr/film/fichefilm-253849/similaire/
Les Leçons Persanes,Persian Lessons,19 janvier 2022,2h 07min,"Drame,Historique,Guerre","Russie,Allemagne,Biélorussie","4,0",953,91,Vadim Perelman,"Nahuel Perez Biscayart,Lars Eidinger,Jonas Nay,Leonie Benesch,Alexander Beyer,Luisa-Céline Gaffron,David Schütter,Peter Beck,Lola Bessis,Marcus Calvin,Nico Ehrenteit,Ingo Hülsmann,Giuseppe Schillaci",Evgueni Galperine,"1942, dans la France occupée, Gilles est arrêté pour être déporté dans un camp en Allemagne. Juste avant de se faire fusiller, il échappe à la mort en jurant aux soldats qu'il n’es",https://fr.web.img2.acsta.net/c_310_420/pictures/21/12/16/09/19/3769159.jpg,https://www.allocine.fr/film/fichefilm-271732/critiques/spectateurs/,https://www.allocine.fr/film/fichefilm-271732/similaire/
Ma,Ma,5 juin 2019,1h 40min,"Epouvante-horreur,Thriller",U.S.A.,"2,3",1968,201,Tate Taylor,"Octavia Spencer,Diana Silvers,Juliette Lewis,McKaley Miller,Corey Fogelmanis,Dominic Burgess,Dante Brown,Tanyell Waivers,Gianni Paolo,Luke Evans,Missi Pyle,Allison Janney,Kyanna Simone Simpson,Victor Turpin,Calvin Williams",Gregory Tripi,"Sue Ann, une femme solitaire vit dans une petite ville de l’Ohio. Un jour, une adolescente ayant récemment emménagé, lui demande d’acheter de l’alcool pour elle et ses amis ; Sue A",https://fr.web.img4.acsta.net/c_310_420/pictures/19/04/17/17/00/1318403.jpg,https://www.allocine.fr/film/fichefilm-262400/critiques/spectateurs/,https://www.allocine.fr/film/fichefilm-262400/similaire/
Gemini Man,Gemini Man,2 octobre 2019,1h 57min,"Action,Science Fiction","U.S.A.,Chine","2,7",5740,454,Ang Lee,"Will Smith,Mary Elizabeth Winstead,Clive Owen,Benedict Wong,Douglas Hodge,Ralph Brown,Linda Emond,Theodora Miranne,Ilia Volok,Justin James Boykin,Tim Connolly,Andrea Sooch,Alexandra Szucs,E.J. Bonilla,Björn Freiberg,David Shae,Fernanda Dorogi",Lorne Balfe,"Henry Brogan, un tueur professionnel, est soudainement pris pour cible et poursuivi par un mystérieux et jeune agent qui peut prédire chacun de ses mouvements.",https://fr.web.img6.acsta.net/c_310_420/pictures/19/09/06/09/24/1577721.jpg,https://www.allocine.fr/film/fichefilm-143746/critiques/spectateurs/,https://www.allocine.fr/film/fichefilm-143746/similaire/
Seules Les Bêtes,Seules Les Bêtes,4 décembre 2019,1h 57min,"Policier,Drame,Thriller","France,Allemagne","3,8",2581,240,Dominik Moll,"Denis Ménochet,Laure Calamy,Damien Bonnard,Nadia Tereszkiewicz,Valeria Bruni Tedeschi,Jenny Bellay,Bastien Bouillon,Guy Roger N'drin,Fred Ulysse",Benedikt Schiefer,"Une femme disparaît. Le lendemain d’une tempête de neige, sa voiture est retrouvée sur une route qui monte vers le plateau où subsistent quelques fermes isolées. Alors que les ge",https://fr.web.img6.acsta.net/c_310_420/pictures/19/10/09/09/45/0008930.jpg,https://www.allocine.fr/film/fichefilm-270615/critiques/spectateurs/,https://www.allocine.fr/film/fichefilm-270615/similaire/
Petit Pays,Petit Pays,28 août 2020,1h 53min,Drame,"France,Belgique","3,8",3974,200,Eric Barbier,"Jean-Paul Rouve,Djibril Vancoppenolle,Dayla De Medina,Isabelle Kabano,Tao Monladja,Ruben Ruhanamilindi,Brian Gakwavu,Kenny Hubbawiwe",Renaud Barbier,"Dans les années 1990, un petit garçon vit au Burundi avec son père, un entrepreneur français, sa mère rwandaise et sa petite soeur. Il passe son temps à faire les quatre cents coup",https://fr.web.img2.acsta.net/c_310_420/pictures/20/01/30/09/38/1317655.jpg,https://www.allocine.fr/film/fichefilm-269704/critiques/spectateurs/,https://www.allocine.fr/film/fichefilm-269704/similaire/
Downton Abbey,Downton Abbey,25 septembre 2019,2h 03min,"Drame,Historique",Grande-Bretagne,"3,8",2913,292,Michael Engler,"Michelle Dockery,Hugh Bonneville,Maggie Smith,Elizabeth McGovern,Laura Carmichael,Jim Carter,Allen Leech,Imelda Staunton,Tuppence Middleton,David Haig,Geraldine James,Simon Jones,Kate Phillips,Stephen Campbell-Moore,Matthew Goode,Kevin Doyle,Joanne Froggatt,Raquel Cassidy,Rob James-Collier,Brendan Coyle,Sophie McShera,Phyllis Logan,Penelope Wilton,Max Brown,Lesley Nicol,Richenda Carey,Philippe Spall,Andrew Havill,Harry Hadden-Paton",John Lunn,Adaptation de la série télévisée à succès Downton Abbey.,https://fr.web.img6.acsta.net/c_310_420/pictures/19/07/18/15/56/5790766.jpg,https://www.allocine.fr/film/fichefilm-257122/critiques/spectateurs/,https://www.allocine.fr/film/fichefilm-257122/similaire/
L'Art du mensonge,The Good Liar,1 janvier 2020,1h 50min,"Drame,Thriller","U.S.A.,Canada","3,5",1829,184,Bill Condon,"Helen Mirren,Ian McKellen,Russell Tovey,Jim Carter,Mark Lewis Jones,Laurie Davidson,Jóhannes Haukur Jóhannesson,Lucian Msamati,Phil Dunster,Tunji Kasim,Spike White,Stella Stocker,Daniel Betts,Nell Williams,Celine Buckens,Athena Strates,Aleksandar Jovanovic,Michael Culkin,Dino Kelly,Manoj Anand",Carter Burwell,"Escroc professionnel, Roy Courtnay a déjà en vue sa prochaine cible : Betty McLeish, récemment devenue veuve, dont la fortune s'élève à des millions de dollars. Dès la première ren",https://fr.web.img6.acsta.net/c_310_420/pictures/19/12/09/16/14/2332513.jpg,https://www.allocine.fr/film/fichefilm-263277/critiques/spectateurs/,https://www.allocine.fr/film/fichefilm-263277/similaire/
Dumbo,Dumbo,27 mars 2019,1h 52min,"Aventure,Famille,Fantastique",U.S.A.,"3,8",7707,514,Tim Burton,"Colin Farrell,Danny DeVito,Michael Keaton,Eva Green,Alan Arkin,Nico Parker,Finley Hobbins,Roshan Seth,Deobia Oparei,Joseph Gatt,Sharon Rooney,Sandy Martin,Michael Buffer,Lucy DeVito,Lars Eidinger,Douglas Reith,Suan-Li Ong,Bern Collaco,Joakim Skarli,Greg Canestrari,Philip Rosch,Bernardo Santos",Danny Elfman,"Les enfants de Holt Farrier, ex-artiste de cirque chargé de s’occuper d’un éléphanteau dont les oreilles démesurées sont la risée du public, découvrent que ce dernier sait voler...",https://fr.web.img5.acsta.net/c_310_420/pictures/18/11/15/09/12/3593965.jpg,https://www.allocine.fr/film/fichefilm-230141/critiques/spectateurs/,https://www.allocine.fr/film/fichefilm-230141/similaire/
Aladdin,Aladdin,22 mai 2019,2h 09min,"Aventure,Famille,Fantastique",U.S.A.,"3,7",9282,852,Guy Ritchie,"Will Smith,Mena Massoud,Naomi Scott,Marwan Kenzari,Nasim Pedrad,Navid Negahban,Billy Magnussen,Numan Acar,Jordan A. Nash,Nikkita Chadha,Joey Ansah,Sophie Carmen-Jones,Bern Collaco,Cassie Clare,Hiten Patel,Amer Chadha-Patel",Alan Menken,"Quand un charmant garçon des rues du nom d’Aladdin cherche à conquérir le cœur de la belle, énigmatique et fougueuse princesse Jasmine, il fait appel au tout puissant Génie, le seu",https://fr.web.img6.acsta.net/c_310_420/pictures/19/04/19/09/29/4029006.jpg,https://www.allocine.fr/film/fichefilm-250865/critiques/spectateurs/,https://www.allocine.fr/film/fichefilm-250865/similaire/
Brooklyn Affairs,Motherless Brooklyn,4 décembre 2019,2h 25min,"Policier,Drame",U.S.A.,"3,7",7574,345,Edward Norton,"Edward Norton,Gugu Mbatha-Raw,Alec Baldwin,Willem Dafoe,Bruce Willis,Ethan Suplee,Cherry Jones,Bobby Cannavale,Dallas Roberts,Josh Pais,Fisher Stevens,Robert Wisdom,Michael K. Williams,DeShawn White,Leslie Mann,Joseph Siravo,Garrett Richmond,Stephen Adly Guirgis,Olli Haaskivi","Daniel Pemberton,Thom Yorke","New York dans les années 1950. Lionel Essrog, détective privé souffrant du syndrome de Gilles de la Tourette, enquête sur le meurtre de son mentor et unique ami Frank Minna. Grâce ",https://fr.web.img6.acsta.net/c_310_420/pictures/19/10/25/15/24/5126095.jpg,https://www.allocine.fr/film/fichefilm-138087/critiques/spectateurs/,https://www.allocine.fr/film/fichefilm-138087/similaire/
7. Koğuştaki Mucize,7. Koğuştaki Mucize,24 octobre 2022,2h 12min,Drame,Turquie,"4,2",7466,681,Mehmet Ada Öztekin,"Aras Bulut İynemli,Nisa Sofiya Aksongur,Deniz Baysal,Yurdaer Okur,İlker Aksum,Celile Toyon,Mesut Akusta,Sarp Akkaya,Yıldıray Şahinler,Deniz Celiloğlu,Gülçin Kültür Şahin,Ferit Kaya,Cankat Aydos,Hayal Köseoğlu,Doğukan Polat",Hasan Özsüt,"Séparé de sa fille, un père avec un handicap mental doit prouver son innocence lorsqu’il est arrêté pour le meurtre d’une enfant.",https://fr.web.img2.acsta.net/c_310_420/pictures/19/10/08/15/52/1926679.jpg,https://www.allocine.fr/film/fichefilm-275065/critiques/spectateurs/,https://www.allocine.fr/film/fichefilm-275065/similaire/
Portrait de la jeune fille en feu,Portrait de la jeune fille en feu,18 septembre 2019,2h 02min,"Drame,Historique",France,"4,0",5372,381,Céline Sciamma,"Noémie Merlant,Adèle Haenel,Luàna Bajrami,Valeria Golino,Armande Boulanger,Christel Baras,Guy Delamarche,Michèle Clément,Raphaëlle Doyle","Para One,Arthur Simonini","1770. Marianne est peintre et doit réaliser le portrait de mariage d’Héloïse, une jeune femme qui vient de quitter le couvent. Héloïse résiste à son destin d’épouse en refusant de ",https://fr.web.img5.acsta.net/c_310_420/pictures/19/07/19/11/39/2251576.jpg,https://www.allocine.fr/film/fichefilm-265621/critiques/spectateurs/,https://www.allocine.fr/film/fichefilm-265621/similaire/
L'Intervention,L'Intervention,30 janvier 2019,1h 38min,"Action,Drame",France,"3,5",1911,200,Fred Grivois,"Alban Lenoir,Olga Kurylenko,Michaël Abiteboul,David Murgia,Sébastien Lalanne,Guillaume Labbé,Kevin Layne (II),Ben Cura,Vincent Perez,Josiane Balasko,Kelyan Kezbari","Fabien Kourtzer,Mike Kourtzer","1976 à Djibouti, dernière colonie française. Des terroristes prennent en otage un bus d’enfants de militaires français et s’enlisent à une centaine de mètres de la frontière avec l",https://fr.web.img4.acsta.net/c_310_420/pictures/18/12/14/14/09/2237470.jpg,https://www.allocine.fr/film/fichefilm-261322/critiques/spectateurs/,https://www.allocine.fr/film/fichefilm-261322/similaire/
The Blackout : Invasion Earth,Avanpost,10 septembre 2020,2h 33min,"Action,Science Fiction,Thriller",Russie,"2,9",273,36,"Nathalia Hencker,Egor Baranov","Filipp Avdeyev,Yura Borisov,Aleksey Chadov,Oleg Boyko,Maxim Emelianov,Pyotr Fyodorov,Sergey Godin,Lukerya Ilyashenko,Svetlana Ivanova,Elena Lyadova,Konstantin Lavronenko,Vladimir Steklov,Angelina Strechina",Ryan Otter,"La Terre est frappée par un blackout sans précédent, l'électricité ne fonctionne plus nulle part. A l'exception d'une zone située en Europe centrale. Une escouade se constitue pour",https://fr.web.img4.acsta.net/c_310_420/pictures/20/05/05/18/08/1930002.jpg,https://www.allocine.fr/film/fichefilm-282451/critiques/spectateurs/,https://www.allocine.fr/film/fichefilm-282451/similaire/
La Plateforme,El hoyo,26 juin 2020,1h 34min,"Epouvante-horreur,Science Fiction",Espagne,"3,3",11778,507,Galder Gaztelu-Urrutia,"Ivan Massagué,Zorion Eguileor,Antonia San Juan,Alexandra Masangkay,Emilio Buale,Algis Arlauskas,Miriam Martín,Mario Pardo,Eric Goode",Aránzazu Calleja,"Dans une prison-tour, une dalle transportant de la nourriture descend d'étage en étage, un système qui favorise les premiers servis et affame les derniers.",https://fr.web.img5.acsta.net/c_310_420/pictures/19/09/02/16/57/3762755.jpg,https://www.allocine.fr/film/fichefilm-258016/critiques/spectateurs/,https://www.allocine.fr/film/fichefilm-258016/similaire/
Rocketman,Rocketman,29 mai 2019,2h 01min,"Biopic,Comédie musicale",Grande-Bretagne,"4,0",7767,553,Dexter Fletcher,"Taron Egerton,Jamie Bell,Richard Madden,Bryce Dallas Howard,Steven Mackintosh,Gemma Jones,Kamil Lemieszewski,Stephen Graham,Alison Ball,Tom Bennett,Tate Donovan,Harriet Walter,Charlie Rowe,Jess Radomska,Bern Collaco,Sophie Carmen-Jones,Joakim Skarli,Kit Connor,Janice Cooke-Leonard,Demetri Goritsas,Jamie Bacon,Graham Fletcher-Cook,Ziad Abaza,Sarah Sharman",Matthew Margeson,"Rocketman nous raconte la vie hors du commun d’Elton John, depuis ses premiers succès jusqu’à sa consécration internationale.",https://fr.web.img6.acsta.net/c_310_420/pictures/19/02/19/14/09/3570616.jpg,https://www.allocine.fr/film/fichefilm-197810/critiques/spectateurs/,https://www.allocine.fr/film/fichefilm-197810/similaire/
Simetierre,Pet Sematary,10 avril 2019,1h 41min,Epouvante-horreur,U.S.A.,"2,6",3676,380,"Kevin Kölsch,Dennis Widmyer","Jason Clarke,Amy Seimetz,John Lithgow,Jeté Laurence,Alyssa Brooke Levine,Obssa Ahmed,Frank Schorpion,Linda E. Smith,Naomi Frenette",Christopher Young,"Le docteur Louis Creed, sa femme Rachel et leurs deux jeunes enfants quittent Boston pour s'installer dans une région rurale du Maine. Près de sa maison, le docteur découvre un mys",https://fr.web.img4.acsta.net/c_310_420/pictures/19/02/08/09/45/4614816.jpg,https://www.allocine.fr/film/fichefilm-178703/critiques/spectateurs/,https://www.allocine.fr/film/fichefilm-178703/similaire/
Rendez-vous Chez Les Malawas,Rendez-vous Chez Les Malawas,25 décembre 2019,,Comédie,"France,Belgique","1,5",4448,300,James Huth,"Christian Clavier,Michaël Youn,Ramzy Bedia,Sylvie Testud,Pascal Elbé,François Levantal,Bass Dhem,Thor Schenker,Camille Japy",Bruno Coulais,"Pour la spéciale Noël de son émission phare Rencontre au bout du bout du monde, Léo Poli emmène non pas un, mais quatre invités exceptionnels. Est-ce vraiment une bonne idée? Nos s",https://fr.web.img6.acsta.net/c_310_420/pictures/19/10/07/10/01/3752736.jpg,https://www.allocine.fr/film/fichefilm-265573/critiques/spectateurs/,https://www.allocine.fr/film/fichefilm-265573/similaire/
J'accuse,J'accuse,13 novembre 2019,2h 12min,"Drame,Historique,Thriller","France,Italie","3,8",14212,819,Roman Polanski,"Jean Dujardin,Louis Garrel,Emmanuelle Seigner,Melvil Poupaud,Grégory Gadebois,Hervé Pierre,Wladimir Yordanoff,Didier Sandre,Eric Ruf,Mathieu Amalric,Laurent Stocker,Vincent Perez,Michel Vuillermoz,Vincent Grass,Denis Podalydès,André Marcon,Damien Bonnard,Laurent Natrella,Bruno Raffaelli,Michèle Clément,Kevin Garnichat,Pierre Léon Luneau,Edouard Michelon,Charles Tesnière,Yannik Landrein",Alexandre Desplat,"Pendant les 12 années qu’elle dura, l’Affaire Dreyfus déchira la France, provoquant un véritable séisme dans le monde entier.",https://fr.web.img6.acsta.net/c_310_420/pictures/19/09/30/14/41/4194086.jpg,https://www.allocine.fr/film/fichefilm-229982/critiques/spectateurs/,https://www.allocine.fr/film/fichefilm-229982/similaire/
Comme des bêtes 2,The Secret Life of Pets 2,31 juillet 2019,1h 26min,"Animation,Comédie,Famille",U.S.A.,"3,5",3088,188,,,,"Le Fox-Terrier Max doit faire face à un grand bouleversement : sa propriétaire Katie s’est mariée et a eu un adorable bébé, Liam. Max est tellement obsédé par la garde du petit, qu",https://fr.web.img6.acsta.net/c_310_420/pictures/19/01/16/13/55/1979607.jpg,https://www.allocine.fr/film/fichefilm-249277/critiques/spectateurs/,https://www.allocine.fr/film/fichefilm-249277/similaire/
Sound of Metal,Sound of Metal,16 juin 2021,2h 00min,"Drame,Musical","U.S.A.,Belgique","4,1",2217,118,Darius Marder,"Riz Ahmed,Olivia Cooke,Lauren Ridloff,Mathieu Amalric,Paul Raci,Domenico Toledo,Chelsea Lee,Shaheem Sanchez,Chris Perfetti,Bill Thorpe,Michael Tow,William Xifaras,Tom Kemp,Hillary Baack","Abraham Marder,Nicolas Becker","Ruben et Lou, ensemble à la ville comme à la scène, sillonnent les Etats-Unis entre deux concerts. Un soir, Ruben est gêné par des acouphènes, et un médecin lui annonce qu'il sera ",https://fr.web.img6.acsta.net/c_310_420/pictures/21/05/25/16/07/3474533.jpg,https://www.allocine.fr/film/fichefilm-244574/critiques/spectateurs/,https://www.allocine.fr/film/fichefilm-244574/similaire/
Bronx,Bronx,30 octobre 2020,1h 56min,"Action,Policier,Drame",France,"2,7",3979,311,Olivier Marchal,"Lannick Gautry,Stanislas Merhar,Kaaris,Jean Reno,David Belle,Patrick Catalifo,Moussa Maaskri,Catherine Marchal,Francis Renaud,Erika Sainte,Jeanne Bournaud,Dani,Eriq Ebouaney,Alain Figlarz,Gérard Lanvin,Yvan Sorel",Erwann Kermorvant,"Dans les quartiers Nord de Marseille, une tuerie orchestrée par le clan Bastiani a lieu. Deux rivaux sont en charge de l’enquête, Vronski, un flic de la brigade antigang et Costa, ",https://fr.web.img5.acsta.net/c_310_420/pictures/20/10/09/18/05/4227202.jpg,https://www.allocine.fr/film/fichefilm-271236/critiques/spectateurs/,https://www.allocine.fr/film/fichefilm-271236/similaire/
Jojo Rabbit,Jojo Rabbit,29 janvier 2020,1h 48min,"Comédie,Drame,Guerre",U.S.A.,"3,9",11848,461,Taika Waititi,"Roman Griffin Davis,Thomasin McKenzie,Scarlett Johansson,Taika Waititi,Sam Rockwell,Rebel Wilson,Alfie Allen,Stephen Merchant,Luke Brandon Field,Sam Haygarth,Stanislav Callas,Brian Caspe,Curtis Matthew,Robert East",Michael Giacchino,Jojo est un petit allemand solitaire. Sa vision du monde est mise à l’épreuve quand il découvre que sa mère cache une jeune fille juive dans leur grenier. Avec la seule aide de son,https://fr.web.img6.acsta.net/c_310_420/pictures/19/10/15/10/55/1009759.jpg,https://www.allocine.fr/film/fichefilm-258998/critiques/spectateurs/,https://www.allocine.fr/film/fichefilm-258998/similaire/
Donne-moi des ailes,Donne-moi des ailes,9 octobre 2019,1h 53min,"Aventure,Famille","France,Norvège","4,0",5658,536,Nicolas Vanier,"Louis Vazquez,Jean-Paul Rouve,Mélanie Doutey,Frédéric Saurel,Lilou Fogli,Grégori Baquet,Dominique Pinon,Ariane Pirié,Philippe Magnan,Cédric Meusburger",Armand Amar,"La perspective de passer trois semaines de vacances en Camargue chez son père Christian n'enchante guère Thomas, qui préfère les jeux vidéos à la nature. L'adolescent découvre que ",https://fr.web.img4.acsta.net/c_310_420/pictures/19/07/01/10/58/0461610.jpg,https://www.allocine.fr/film/fichefilm-264387/critiques/spectateurs/,https://www.allocine.fr/film/fichefilm-264387/similaire/
The Dead Don't Die,The Dead Don't Die,14 mai 2019,1h 45min,"Comédie,Epouvante-horreur",U.S.A.,"2,1",4291,613,Jim Jarmusch,"Bill Murray,Adam Driver,Tilda Swinton,Chloë Sevigny,Steve Buscemi,Danny Glover,Caleb Landry Jones,Rosie Perez,Iggy Pop,Sara Driver,RZA,Carol Kane,Austin Butler,Luka Sabbat,Selena Gomez,Tom Waits,Rosal Colon",,"Dans la sereine petite ville de Centerville, quelque chose cloche. La lune est omniprésente dans le ciel, la lumière du jour se manifeste à des horaires imprévisibles et les animau",https://fr.web.img4.acsta.net/c_310_420/pictures/19/04/10/16/21/2574607.jpg,https://www.allocine.fr/film/fichefilm-266163/critiques/spectateurs/,https://www.allocine.fr/film/fichefilm-266163/similaire/
Chanson Douce,Chanson Douce,27 novembre 2019,1h 40min,"Drame,Judiciaire",France,"3,1",2234,246,Lucie Borleteau,"Karin Viard,Leïla Bekhti,Antoine Reinartz,Assya Da Silva,Noëlle Renaude,Rehab Mehal,Martine Chevallier,Céline Fuhrer,Anouk Féral",Pierre Desprats,"Paul et Myriam ont deux enfants en bas âge. Ils engagent Louise, une nounou expérimentée, pour que Myriam puisse reprendre le travail. Louise se montre dévouée, consciencieuse, vol",https://fr.web.img6.acsta.net/c_310_420/pictures/19/09/20/12/00/5746838.jpg,https://www.allocine.fr/film/fichefilm-254956/critiques/spectateurs/,https://www.allocine.fr/film/fichefilm-254956/similaire/
Les deux Papes,The Two Popes,10 avril 2020,2h 06min,Drame,"Grande-Bretagne,Italie,Argentine,U.S.A.","3,8",4015,108,Fernando Meirelles,"Anthony Hopkins,Jonathan Pryce,Juan Minujin,Sidney Cole,Federico Torre,Matthew T. Reynolds,María Ucedo,Sara Pallini,Luis Gnecco,Cristina Banegas,Renato Scarpa,Germán De Silva,Libero De Rienzo",Bryce Dessner,"Dans cette histoire inspirée de faits réels, le pape Benoît XVI tisse une amitié improbable avec le futur pape François à un moment clé pour l'Église catholique..",https://fr.web.img5.acsta.net/c_310_420/pictures/19/12/02/12/19/5989871.jpg,https://www.allocine.fr/film/fichefilm-258752/critiques/spectateurs/,https://www.allocine.fr/film/fichefilm-258752/similaire/
Star Wars: L'Ascension de Skywalker,Star Wars: The Rise of Skywalker,18 décembre 2019,2h 22min,"Aventure,Science Fiction",U.S.A.,"3,0",30613,2764,J.J. Abrams,"Daisy Ridley,Adam Driver,Oscar Isaac,Keri Russell,John Boyega,Billy Dee Williams,Carrie Fisher,Mark Hamill,Domhnall Gleeson,Anthony Daniels,Lupita Nyong'o,Dominic Monaghan,Kelly Marie Tran,Billie Lourd,Joonas Suotamo,Naomi Ackie,Ian McDiarmid,Richard E. Grant,Greg Grunberg,Simon Paisley Day,Denis Lawson,Nasser Memarzia,Richard Bremmer,Geff Francis,Alison Rose,Paul Kasey,Shirley Henderson,Mandeep Dhillon",John Williams,La conclusion de la saga Skywalker. De nouvelles légendes vont naître dans cette bataille épique pour la liberté.,https://fr.web.img5.acsta.net/c_310_420/pictures/20/10/02/12/21/3764004.png,https://www.allocine.fr/film/fichefilm-215094/critiques/spectateurs/,https://www.allocine.fr/film/fichefilm-215094/similaire/
El Camino : un film Breaking Bad,El Camino: A Breaking Bad Movie,11 octobre 2019,2h 02min,"Drame,Thriller",U.S.A.,"3,7",3825,277,Vince Gilligan,"Aaron Paul,Jesse Plemons,Robert Forster,Matt L. Jones,Charles Baker (II),Scott Shepherd (II),Scott MacArthur (II),Tom Bower,Kevin Rankin,Larry Hankin,Tess Harper,Michael Bofshever,Marla Gibbs,Brendan Sexton III,Johnny Ortiz,Jonathan Banks,Bryan Cranston,Gloria Sandoval,Matthew Van Wettering,Chris Bylsma,Krysten Ritter,David Mattey,Cody Renee Cameron",,"À la suite de sa tragique évasion, Jesse doit accepter son passé s'il veut se construire un avenir... ou quelque chose qui y ressemble plus ou moins.",https://fr.web.img3.acsta.net/c_310_420/pictures/19/09/24/17/24/4667551.jpg,https://www.allocine.fr/film/fichefilm-269367/critiques/spectateurs/,https://www.allocine.fr/film/fichefilm-269367/similaire/
Grâce à Dieu,Grâce à Dieu,20 février 2019,2h 18min,Drame,"France,Belgique","4,2",5732,485,François Ozon,"Melvil Poupaud,Denis Ménochet,Swann Arlaud,Eric Caravaca,François Marthouret,Bernard Verley,Josiane Balasko,Martine Erhel,Hélène Vincent,François Chattot,Frédéric Pierrot,Aurélia Petit,Julie Duclos,Jeanne Rosa,Amélie Daure,Nicolas Bridet,Pierre Lottin,Fejria Deliba,Baya Rehaz,Stéphane Brel,Martine Schambacher,Serge Flamenbaum,Christian Sinniger,Bernadette Le Sache,Max Libert,Nicolas Bauwens,Timi-Joy Marbot,Olivier Faliez,Jules Gauzelin","Evgueni Galperine,Sacha Galperine","Alexandre vit à Lyon avec sa femme et ses enfants. Un jour, il découvre par hasard que le prêtre qui a abusé de lui aux scouts officie toujours auprès d’enfants. Il se lance alors ",https://fr.web.img6.acsta.net/c_310_420/pictures/19/02/08/11/11/2180797.jpg,https://www.allocine.fr/film/fichefilm-263132/critiques/spectateurs/,https://www.allocine.fr/film/fichefilm-263132/similaire/
Douleur et gloire,Dolor y gloria,17 mai 2019,1h 54min,Drame,Espagne,"3,9",4821,409,Pedro Almodóvar,"Antonio Banderas,Asier Etxeandia,Leonardo Sbaraglia,Penélope Cruz,Nora Navas,Julieta Serrano,César Vicente,Cecilia Roth,Asier Flores,Susi Sánchez,Raúl Arévalo,Pedro Casablanc,Julián López,Eva Martín,Agustín Almodóvar,Alba García,Xavi Sáez,Paqui Horcajo",Alberto Iglesias,"Une série de retrouvailles après plusieurs décennies, certaines en chair et en os, d’autres par le souvenir, dans la vie d’un réalisateur en souffrance. Premières amours, les suiva",https://fr.web.img6.acsta.net/c_310_420/pictures/19/04/18/11/45/1896822.jpg,https://www.allocine.fr/film/fichefilm-264147/critiques/spectateurs/,https://www.allocine.fr/film/fichefilm-264147/similaire/
Us,Us,20 mars 2019,1h 56min,"Epouvante-horreur,Thriller",U.S.A.,"3,1",7380,651,Jordan Peele,"Lupita Nyong'o,Winston Duke,Elisabeth Moss,Tim Heidecker,Shahadi Wright Joseph,Evan Alex,Noelle Sheldon,Cali Sheldon,Anna Diop,Yahya Abdul-Mateen II,Kara Hayward,Duke Nicholson,Darrel Cherney",Michael Abels,"De retour dans sa maison d’enfance, à Santa Cruz sur la côte Californienne, Adelaïde Wilson a décidé de passer des vacances de rêves avec son mari Gabe et leurs deux enfants : Zora",https://fr.web.img6.acsta.net/c_310_420/pictures/19/03/14/10/51/3421837.jpg,https://www.allocine.fr/film/fichefilm-255999/critiques/spectateurs/,https://www.allocine.fr/film/fichefilm-255999/similaire/
Marriage Story,Marriage Story,14 avril 2020,2h 17min,Drame,U.S.A.,"4,0",9074,234,Noah Baumbach,"Adam Driver,Scarlett Johansson,Laura Dern,Alan Alda,Ray Liotta,Julie Hagerty,Merritt Wever,Azhy Robertson,Wallace Shawn,Martha Kelly,Mark O'Brien,Kyle Bornheimer,Ayden Mayeri,Mickey Sumner,Matthew Maher,Mary Hollis Inboden,Brooke Bloom,Annie Hamilton,Roslyn Ruff,McKinley Belcher III",Randy Newman,Le cinéaste nommé aux Oscars Noah Baumbach porte un regard aussi incisif qu'empathique sur une famille restant unie malgré un mariage en déroute.,https://fr.web.img5.acsta.net/c_310_420/pictures/19/10/18/10/16/3794567.jpg,https://www.allocine.fr/film/fichefilm-261015/critiques/spectateurs/,https://www.allocine.fr/film/fichefilm-261015/similaire/
