title,original_title,date,duration,categories,countries,star_rating,notes,reviews,directors,actors,composers,summary,url_thumbnail,url_reviews,url_similar_movies
Je te veux moi non plus,Je te veux moi non plus,25 mars 2021,1h 40min,Comédie,France,"1,8",1505,477,"Rodolphe Lauga,Inès Reg,Kévin Debonne","Inès Reg,Kévin Debonne,Pauline Clément,Laurie Peret,Anthony Sonigo,Constance Labbé,Michèle Garcia,Fadila Belkebla,Pierre Cévaer,Laura Felpin",,Le film fait partie de la Sélection Officielle de l'Alpe d'Huez 2021,https://fr.web.img2.acsta.net/c_310_420/pictures/21/02/23/10/04/0426276.jpg,https://www.allocine.fr/film/fichefilm-285883/critiques/spectateurs/,https://www.allocine.fr/film/fichefilm-285883/similaire/
A la folie,A la folie,6 septembre 2022,1h 30min,Drame,France,"3,7",290,34,"Andréa Bescond,Eric Métayer","Marie Gillain,Alexis Michalik,Ahmed Sylla,Nicole Ferroni,Mathis Bour,Andréa Bescond,Nicolas Martinez,Christophe Laubion,Hubert Delattre,Aurélie Konaté,Catherine Artigala,Florence Monge,Stéphanie Bataille,David Sollazzo",,"Au beau milieu d’un cocktail entre amis, Anna poignarde son compagnon Damien. Elle est mise en examen pour tentative de meurtre, mais l’affaire est incompréhensible : Anna n’a aucu",https://fr.web.img5.acsta.net/c_310_420/pictures/21/09/07/17/04/1555967.jpg,https://www.allocine.fr/film/fichefilm-287214/critiques/spectateurs/,https://www.allocine.fr/film/fichefilm-287214/similaire/
Vortex,Vortex,13 avril 2022,2h 22min,Drame,"France,Belgique","3,6",880,90,Gaspar Noé,"Françoise Lebrun,Dario Argento,Alex Lutz,Kylian Dheret,Corinne Bruand,Kamel Benchemekh,Joël Clabault,Philippe Rouyer,Jean-Pierre Bouyxou,Charles Morillon",,La vie est une courte fête qui sera vite oubliée.,https://fr.web.img3.acsta.net/c_310_420/pictures/22/02/18/10/59/1557160.jpg,https://www.allocine.fr/film/fichefilm-291311/critiques/spectateurs/,https://www.allocine.fr/film/fichefilm-291311/similaire/
Super-héros malgré lui,Super-héros malgré lui,2 février 2022,1h 22min,"Action,Comédie",France,"3,0",5721,659,Philippe Lacheau,"Philippe Lacheau,Julien Arruti,Tarek Boudali,Élodie Fontan,Alice Dufour,Jean-Hugues Anglade,Amr Waked,Georges Corraface,Brahim Bouhlel,Chantal Ladesou,Valeria Cavalli,Salomé Partouche,Régis Laspalès,Rayane Bensetti,Sième Milady",,"Apprenti comédien en galère, Cédric décroche enfin son premier rôle dans un film de super-héros. Un soir, alors qu'il emprunte la voiture de tournage, il est victime d'un accident ",https://fr.web.img5.acsta.net/c_310_420/pictures/22/01/19/10/17/1349046.jpg,https://www.allocine.fr/film/fichefilm-285884/critiques/spectateurs/,https://www.allocine.fr/film/fichefilm-285884/similaire/
Awake,Awake,9 juin 2021,1h 36min,"Drame,Science Fiction,Thriller",Canada,"1,8",634,81,Mark Raso,"Gina Rodriguez,Ariana Greenblatt,Lucius Hoyos,Shamier Anderson,Jennifer Jason Leigh,Finn Jones,Frances Fisher,Gil Bellows,Barry Pepper,Sergio Di Zio,Brigitte Robinson,Elias Edraki,Alex House,Sebastian Pigott,Patrick Garrow",Antonio Pinto,"Après qu'une catastrophe planétaire prive l'humanité de ses appareils électroniques et de son sommeil, le monde plonge soudain dans le chaos. Jill, une ex-soldate au passé trouble,",https://fr.web.img2.acsta.net/c_310_420/pictures/21/05/25/16/33/0102047.jpg,https://www.allocine.fr/film/fichefilm-274673/critiques/spectateurs/,https://www.allocine.fr/film/fichefilm-274673/similaire/
Le Monde de John,John and the Hole,6 avril 2022,1h 44min,"Drame,Thriller",U.S.A.,"1,5",184,30,Pascual Sisto,"Charlie Shotwell,Michael C. Hall,Jennifer Ehle,Taissa Farmiga,Tamara Hickey,Pamela Jayne Morgan,Georgia Lyman,Ben O'Brien,Elijah Ungvary",,"John ressemble à tous les collégiens de son âge ; élève moyen, il aime jouer aux jeux vidéo en ligne avec ses copains. En famille aussi, il se sent bien… Un jour, il découvre, par ",https://fr.web.img2.acsta.net/c_310_420/pictures/22/06/03/11/05/2509594.jpg,https://www.allocine.fr/film/fichefilm-283759/critiques/spectateurs/,https://www.allocine.fr/film/fichefilm-283759/similaire/
Many Saints Of Newark - Une histoire des Soprano,The Many Saints Of Newark,3 novembre 2021,2h 03min,"Policier,Drame",U.S.A.,"2,8",516,43,Alan Taylor,"Alessandro Nivola,Leslie Odom Jr.,Vera Farmiga,Jon Bernthal,Corey Stoll,Ray Liotta,Michela De Rossi,Michael Gandolfini,Billy Magnussen,John Magaro,Joey Diaz,Germar Gardner,Gabriella Piazza,Lesli Margherita,Talia Balsam,Kathryn Kates,Nick Vallelonga,Ed Marinaro,Mattea Conforti,Robert Montano,Chase Vacnin,Patina Miller,Daryl Edwards",,"Avant d’être une légende du crime, Tony Soprano a fait ses gammes auprès de son oncle, Dickie Moltisanti. Dans un contexte explosif de guerre des gangs, cet intraitable parrain a o",https://fr.web.img6.acsta.net/c_310_420/pictures/21/10/29/17/48/1146500.jpg,https://www.allocine.fr/film/fichefilm-263227/critiques/spectateurs/,https://www.allocine.fr/film/fichefilm-263227/similaire/
Placés,Placés,12 janvier 2022,1h 51min,Comédie dramatique,France,"3,9",1302,194,Nessim Chikhaoui,"Shaïn Boumedine,Julie Depardieu,Philippe Rebbot,Nailia Harzoune,Moussa Mansaly,Aloïse Sauvage,Lucie Charles-Alfred,Elyes Aguis,Laëtitia Clément,Smaïn Fairouze,Souhade Temimi,Djimo,Mohamed Seddiki,Fanta Kebe,David Ban,Théau Courtes,Jamil McCraven,Clémentine Verdier",Demusmaker,"Parce qu’il a oublié sa carte d’identité, Elias ne peut passer les épreuves du concours d’entrée à Sciences Po. À la recherche d’un job en attendant de pouvoir se présenter à nouve",https://fr.web.img2.acsta.net/c_310_420/pictures/21/12/16/10/56/1945763.jpg,https://www.allocine.fr/film/fichefilm-292607/critiques/spectateurs/,https://www.allocine.fr/film/fichefilm-292607/similaire/
Les Méchants,Les Méchants,8 septembre 2021,1h 24min,Comédie,France,"1,8",1987,474,"Mouloud Achour,Dominique Baumard","Roman Frayssinet,Djimo,Ludivine Sagnier,Kyan Khojandi,Alban Ivanov,Mathieu Kassovitz,Anthony Bajon,Samy Naceri,Hakim Jemili,Fadily Camara,Bun-Hay Mean,Redouane Bougheraba,Omar Sy,Oxmo Puccino,Fary,Alexis Manenti,Julian Naceri,Pierre Palmade,Elie Semoun,Kim Chapiron",Nikfurie (la Caution),"Patrick et Sebastien passent la pire journée de leur vie. En quelques heures, ils deviennent les méchants les plus recherchés de France. La raison ? Une fake news montée de toutes ",https://fr.web.img5.acsta.net/c_310_420/pictures/21/08/27/15/59/5323172.jpg,https://www.allocine.fr/film/fichefilm-282008/critiques/spectateurs/,https://www.allocine.fr/film/fichefilm-282008/similaire/
SAS: Rise of the Black Swan,SAS: Red Notice,27 août 2021,2h 04min,"Action,Thriller","Grande-Bretagne,Hongrie,Pays-Bas,Suisse","2,1",522,68,Magnus Martens,"Sam Heughan,Ruby Rose,Andy Serkis,Hannah John-Kamen,Tom Hopper,Noel Clarke,Owain Yeoman,Tom Wilkinson,Jing Lusi,Ray Panthaki,Richard McCabe,Douglas Reith,Anne Reid,Aymen Hamdouchi,Dylan Smith,Sarah Winter,Tim Fellingham,Caroline Boulton",,"Un membre du Special Air Service, Tom Buckingham, tente de sauver 400 otages retenus par des criminels de guerre dans le tunnel sous la Manche.",https://fr.web.img3.acsta.net/c_310_420/pictures/21/02/23/11/55/5426424.jpg,https://www.allocine.fr/film/fichefilm-229008/critiques/spectateurs/,https://www.allocine.fr/film/fichefilm-229008/similaire/
Ouistreham,Ouistreham,12 janvier 2022,1h 47min,Drame,France,"4,0",2331,206,Emmanuel Carrère,"Juliette Binoche,Hélène Lambert,Léa Carne,Émily Madeleine,Patricia Prieur,Évelyne Porée,Didier Pupin,Louise Pociecka,Aude Ruyter",Mathieu Lamboley,"Marianne Winckler, écrivaine reconnue, entreprend un livre sur le travail précaire. Elle s’installe près de Caen et, sans révéler son identité, rejoint une équipe de femmes de ména",https://fr.web.img6.acsta.net/c_310_420/pictures/21/12/30/12/41/5606829.jpg,https://www.allocine.fr/film/fichefilm-268224/critiques/spectateurs/,https://www.allocine.fr/film/fichefilm-268224/similaire/
Une jeune fille qui va bien,Une jeune fille qui va bien,26 janvier 2022,1h 38min,"Drame,Historique",France,"3,3",1246,162,Sandrine Kiberlain,"Rebecca Marder,André Marcon,Anthony Bajon,Françoise Widhoff,India Hair,Florence Viala,Ben Attal,Cyril Metzger,Jean Chevalier,Théo Augier,Bastien Bouillon,Mathilde Weil,Lucie Gallo,Elsa Guedj,Jérôme Deschamps,Léa Rostain,Frédéric Noaille,Vladislav Galard,Florence Janas,Audrey Bonnet,Pierre Léon Luneau","Marc Marder,Patrick Desreumaux","Irène, jeune fille juive, vit l’élan de ses 19 ans à Paris, l’été 1942. Sa famille la regarde découvrir le monde, ses amitiés, son nouvel amour, sa passion du théâtre… Irène veut d",https://fr.web.img6.acsta.net/c_310_420/pictures/22/01/05/11/53/3535032.jpg,https://www.allocine.fr/film/fichefilm-284963/critiques/spectateurs/,https://www.allocine.fr/film/fichefilm-284963/similaire/
Army Of The Dead,Army Of The Dead,22 mai 2021,2h 28min,"Action,Epouvante-horreur",U.S.A.,"2,3",3352,389,Zack Snyder,"Dave Bautista,Ella Purnell,Omari Hardwick,Ana de la Reguera,Theo Rossi,Matthias Schweighöfer,Nora Arnezeder,Hiroyuki Sanada,Garret Dillahunt,Tig Notaro,Raul Castillo,Huma Qureshi,Samantha Win,Richard Cetrone,Michael Cassidy,Steve Corona,Chelsea Edmundson,Zach Rose,Wayne Dalglish,Antonio Leyba,Colin Jones (II),Sarah Minnich",Junkie XL,"Profitant d'une attaque de zombies à Las Vegas, un groupe de mercenaires fait le pari fou de s'aventurer dans la zone de quarantaine pour tenter le braquage le plus spectaculaire d",https://fr.web.img3.acsta.net/c_310_420/pictures/21/04/15/12/40/4834460.jpg,https://www.allocine.fr/film/fichefilm-271355/critiques/spectateurs/,https://www.allocine.fr/film/fichefilm-271355/similaire/
The Card Counter,The Card Counter,29 décembre 2021,1h 52min,"Drame,Thriller",U.S.A.,"3,4",1643,130,Paul Schrader,"Oscar Isaac,Tiffany Haddish,Tye Sheridan,Willem Dafoe,Alexander Babara,Bobby C. King,Ekaterina Baker,Dylan Flashner,Joel Michaely,Billy Slaughter,Calvin Williams,Amye Gousset,Britton Webb","Robert Levon Been,Giancarlo Vulcano","Mutique et solitaire, William Tell, ancien militaire devenu joueur de poker, sillonne les casinos, fuyant un passé qui le hante. Il croise alors la route de Cirk, jeune homme insta",https://fr.web.img6.acsta.net/c_310_420/pictures/21/11/18/15/22/0526271.jpg,https://www.allocine.fr/film/fichefilm-278524/critiques/spectateurs/,https://www.allocine.fr/film/fichefilm-278524/similaire/
Les Passagers de la nuit,Les Passagers de la nuit,4 mai 2022,1h 51min,Drame,France,"3,8",2530,210,Mikhaël Hers,"Charlotte Gainsbourg,Quito Rayon Richter,Noée Abita,Megan Northam,Thibault Vinçon,Emmanuelle Béart,Laurent Poitrenaux,Didier Sandre,Lilith Grasmug,Calixte Broisin-Doutaz,Eric Feldman (II),Ophelia Kolb,Raphaël Thiéry,Zoé Bruneau,Mounir Margoum,Mohammed Sadi,Calypso Buijtenhuijs",Anton Sanko,"Paris, années 80. Elisabeth vient d’être quittée par son mari et doit assurer le quotidien de ses deux adolescents, Matthias et Judith. Elle trouve un emploi dans une émission de r",https://fr.web.img5.acsta.net/c_310_420/pictures/22/04/12/16/01/3361793.jpg,https://www.allocine.fr/film/fichefilm-284676/critiques/spectateurs/,https://www.allocine.fr/film/fichefilm-284676/similaire/
Ducobu Président !,Ducobu Président !,13 juillet 2022,1h 26min,Comédie,"France,Belgique","1,9",1146,102,Elie Semoun,"Elie Semoun,Émilie Caen,Gabin Tomasino,Gérard Jugnot,Frédérique Bel,Loïc Legendre,François Levantal,Ary Abittan",,"Une nouvelle année scolaire démarre pour Ducobu ! A l’école Saint Potache, une élection exceptionnelle va avoir lieu pour élire le président des élèves. C’est le début d’une campag",https://fr.web.img3.acsta.net/c_310_420/pictures/22/04/15/16/45/2943643.jpg,https://www.allocine.fr/film/fichefilm-291527/critiques/spectateurs/,https://www.allocine.fr/film/fichefilm-291527/similaire/
Sans répit,Sans répit,25 février 2022,1h 36min,"Action,Policier,Thriller",France,"2,0",1084,161,Régis Blondeau,"Franck Gastambide,Simon Abkarian,Michaël Abiteboul,Tracy Gotoas,Serge Hazanavicius,Jemima West,Nabil Missoumi,Laurent Maurel,Fabrice de la Villeherve,Kévin Debonne,Pierre Cévaer,Blaise Ludik,Arnaud Dupont,Marcel Baclet","Julien Grunberg,Paul-Marie Barbier","Alors qu'il fait l'objet d'une enquête pour corruption, le lieutenant Thomas Blin doit se rendre en pleine nuit aux funérailles de sa mère. En voulant éviter un chien sur le route,",https://fr.web.img6.acsta.net/c_310_420/pictures/22/02/04/08/52/5508154.jpg,https://www.allocine.fr/film/fichefilm-291593/critiques/spectateurs/,https://www.allocine.fr/film/fichefilm-291593/similaire/
Vaillante,Fireheart,2 février 2022,1h 33min,"Animation,Comédie,Famille","France,Canada","3,3",753,76,,,,"Depuis qu'elle est enfant, Georgia Nolan n’a qu’une seule ambition : devenir pompier comme son père ! Hélas, à New York en 1932, les femmes n’ont pas le droit d'exercer cette profe",https://fr.web.img4.acsta.net/c_310_420/pictures/21/10/27/12/05/2804678.jpg,https://www.allocine.fr/film/fichefilm-264699/critiques/spectateurs/,https://www.allocine.fr/film/fichefilm-264699/similaire/
Petite Nature,Petite Nature,9 mars 2022,1h 35min,"Comédie,Drame",France,"4,0",1206,96,Samuel Theis,"Aliocha Reinert,Antoine Reinartz,Mélissa Olexa,Izïa Higelin,Abdel Benchendikh,Claire Burger,Angélique Litzenburger,Samuel Theis",Ulysse Klotz,"Johnny a dix ans. Mais à son âge, il ne s’intéresse qu’aux histoires des adultes. Dans sa cité HLM en Lorraine, il observe avec curiosité la vie sentimentale agitée de sa jeune mèr",https://fr.web.img4.acsta.net/c_310_420/pictures/22/01/31/14/52/4036985.jpg,https://www.allocine.fr/film/fichefilm-276329/critiques/spectateurs/,https://www.allocine.fr/film/fichefilm-276329/similaire/
Murder Party,Murder Party,9 mars 2022,1h 43min,"Comédie,Policier",France,"2,0",1021,116,Nicolas Pleskof,"Alice Pol,Miou-Miou,Eddy Mitchell,Pablo Pauly,Pascale Arbillot,Gustave Kervern,Sarah Stern,Zabou Breitman",Amaury Chabauty,"Jeanne Chardon-Spitzer, brillante architecte, se voit confier la réhabilitation du somptueux manoir des Daguerre, étrange famille à la tête d’un empire du jeu de société. Quand Cés",https://fr.web.img6.acsta.net/c_310_420/pictures/21/08/17/11/34/1421287.jpg,https://www.allocine.fr/film/fichefilm-283722/critiques/spectateurs/,https://www.allocine.fr/film/fichefilm-283722/similaire/
Boss Level,Boss Level,6 mars 2021,1h 41min,"Action,Science Fiction,Thriller",U.S.A.,"3,3",1364,119,Joe Carnahan,"Frank Grillo,Mel Gibson,Naomi Watts,Will Sasso,Annabelle Wallis,Sheaun McKinney,Ken Jeong,Mathilde Ollivier,Michelle Yeoh,Eric Etebari,Meadow Williams,Selina Lo,John Cenatiempo,Buster Reeves",Clinton Shorter,"Roy Pulver a un vrai problème : chaque matin, il est attaqué par une horde d’assassins venus le liquider. Mais qu’il soit abattu, poignardé ou éparpillé en mille morceaux, sa journ",https://fr.web.img6.acsta.net/c_310_420/pictures/21/02/15/10/30/1657850.jpg,https://www.allocine.fr/film/fichefilm-260692/critiques/spectateurs/,https://www.allocine.fr/film/fichefilm-260692/similaire/
Friendzone,Friendzone,29 septembre 2021,1h 28min,"Comédie,Romance",France,"2,6",547,42,Charles Van Tieghem,"Mickael Lumière,Manon Azem,Fadily Camara,Eva Danino,Constance Arnoult,Eloise Valli,Bruno Sanches,Maxime Gasteuil,Simon Aouizerate,Nada El Belkasmi",,"N'en pouvant plus des relations platoniques, Thibault croit voir sa chance tourner lorsqu'il rencontre Rose. Mais comment passer de meilleur pote à petit ami ?",https://fr.web.img4.acsta.net/c_310_420/pictures/21/08/26/18/00/1318771.jpg,https://www.allocine.fr/film/fichefilm-295778/critiques/spectateurs/,https://www.allocine.fr/film/fichefilm-295778/similaire/
Kate,Kate,11 septembre 2021,1h 46min,"Action,Aventure,Thriller",U.S.A.,"2,9",1066,103,Cedric Nicolas-Troyan,"Mary Elizabeth Winstead,Woody Harrelson,Michiel Huisman,Tadanobu Asano,Miyavi,Jun Kunimura,Miku Patricia Martineau,Amelia Crouch,Gemma Brooke Allen",Nathan Barr,"Minutieuse et prodigieusement douée, Kate est l'exemple même de la machine à tuer parfaitement rodée et au sommet de son art. Mais voilà qu'un jour elle échoue à éliminer sa cible,",https://fr.web.img3.acsta.net/c_310_420/pictures/21/08/16/10/26/0653161.jpg,https://www.allocine.fr/film/fichefilm-260891/critiques/spectateurs/,https://www.allocine.fr/film/fichefilm-260891/similaire/
Icare,Icare,30 mars 2022,1h 16min,Animation,"Luxembourg,Belgique,France","3,9",337,39,,,,"Sur l’île de Crète, chaque recoin est un terrain de jeu pour Icare, le fils du grand inventeur Dédale. Lors d'une exploration près du palais de Cnossos, le petit garçon fait une ét",https://fr.web.img4.acsta.net/c_310_420/pictures/22/02/07/13/47/1546084.jpg,https://www.allocine.fr/film/fichefilm-296976/critiques/spectateurs/,https://www.allocine.fr/film/fichefilm-296976/similaire/
Les Enquêtes du département V : L'Effet Papillon,Marco effekten,26 mai 2022,2h 05min,Thriller,"Danemark,République tchèque","2,6",306,31,Martin Zandvliet,"Ulrich Thomsen,Zaki Youssef,Sofie Torp,Henrik Noél Olesen,Anders Matthesen,Lisa Carlehed,Caspar Phillipson,Mads Reuther,Thomas W. Gabrielsson,Zdenek Godla,Shanti Roney",Sune Martin,"Marco, un adolescent de 14 ans sans domicile, est arrêté à la frontière danoise alors qu’il a en sa possession le passeport d’un fonctionnaire porté disparu. Peu avant s’être volat",https://fr.web.img4.acsta.net/c_310_420/pictures/22/04/15/17/11/1378520.jpg,https://www.allocine.fr/film/fichefilm-281000/critiques/spectateurs/,https://www.allocine.fr/film/fichefilm-281000/similaire/
Farha,Farha,8 décembre 2022,1h 32min,Drame,"Jordanie,Suède,Arabie Saoudite","4,2",294,71,Darin J. Sallam,"Karam Taher,Ashraf Barhom,Ali Suliman,Sameera Asir,Majd Eid,Firas Taybeh,Samuel Kaczorowski,Tala Gammoh",Nadim Mishlawi,"Dans la Palestine de 1948, une jeune fille de 14 ans assiste, depuis un garde-manger fermé à clé, à la catastrophe qui dévaste sa maison...",https://fr.web.img3.acsta.net/c_310_420/pictures/21/08/20/01/37/1792057.jpg,https://www.allocine.fr/film/fichefilm-295522/critiques/spectateurs/,https://www.allocine.fr/film/fichefilm-295522/similaire/
Mad God,Mad God,26 avril 2023,1h 24min,"Animation,Expérimental,Fantastique,Epouvante-horreur",U.S.A.,"3,4",593,57,Phil Tippett,"Tom Gibbons,Chris Morley,Anthony Ruivivar,Phil Tippett",,"Un Assassin surgit des abysses dans une cloche à plongée et s’enfonce au cœur d’un univers infernal peuplé de créatures mutantes et de scientifiques fous. Bientôt capturé, il devie",https://fr.web.img4.acsta.net/c_310_420/pictures/23/03/20/09/23/0891602.jpg,https://www.allocine.fr/film/fichefilm-294192/critiques/spectateurs/,https://www.allocine.fr/film/fichefilm-294192/similaire/
Suprêmes,Suprêmes,24 novembre 2021,1h 52min,"Biopic,Musical",France,"3,4",2959,165,Audrey Estrougo,"Théo Christine,Sandor Funtek,Félix Lefebvre,César Chouraqui,François Neycken,Vini Vivarelli,Chloé Lecerf,Nathanaël Beausivoir,Clément Bresson,Najim Ziani",Cut Killer,"1989. Dans les cités déshéritées du 93, une bande de copains trouve un moyen d’expression grâce au mouvement hip-hop tout juste arrivé en France. Après la danse et le graff, JoeySt",https://fr.web.img6.acsta.net/c_310_420/pictures/21/09/22/10/13/3584560.jpg,https://www.allocine.fr/film/fichefilm-270890/critiques/spectateurs/,https://www.allocine.fr/film/fichefilm-270890/similaire/
Dans les angles morts,Things Heard And Seen,29 avril 2021,1h 59min,"Epouvante-horreur,Thriller",U.S.A.,"2,1",826,106,"Robert Pulcini,Shari Springer Berman","James Norton,Amanda Seyfried,Ana Sophia Heger,Alex Neustaedter,Jack Gore,Natalia Dyer,F. Murray Abraham,Karen Allen,Rhea Seehorn,James Urbaniak,Michael O'Keefe,Michael Abbott Jr.,Cotter Smith,Kelcy Griffin,Dan Daily,Kristin Griffith,Emily Dorsch,Joe Lanza,Marion McCorry",,Adaptation de l'ouvrage All Things Cease to Appear écrit par Elizabeth Brundage.,https://fr.web.img6.acsta.net/c_310_420/pictures/21/04/06/10/44/4355658.jpg,https://www.allocine.fr/film/fichefilm-277924/critiques/spectateurs/,https://www.allocine.fr/film/fichefilm-277924/similaire/
Affamés,Antlers,17 novembre 2021,1h 39min,"Epouvante-horreur,Thriller",U.S.A.,"2,4",1707,113,Scott Cooper,"Keri Russell,Jesse Plemons,Jeremy T. Thomas,Graham Greene (II),Scott Haze,Rory Cochrane,Amy Madigan,Cody Davis,Sawyer Jones,Dendrie Taylor,Glynis Davies,Emily Delahunty,Dorian Kingi,Michael Eklund,Jay Brazeau,Jake T. Roberts,Andy Thompson",Javier Navarrete,"Dans une petite ville minière de l’Oregon, une institutrice et son frère policier enquêtent sur un jeune écolier. Les secrets de ce dernier vont entraîner d’effrayantes conséquence",https://fr.web.img2.acsta.net/c_310_420/pictures/21/09/20/12/25/4274913.jpg,https://www.allocine.fr/film/fichefilm-261340/critiques/spectateurs/,https://www.allocine.fr/film/fichefilm-261340/similaire/
Les Amours d’Anaïs,Les Amours d’Anaïs,15 septembre 2021,1h 39min,"Comédie,Romance",France,"3,0",1870,129,Charline Bourgeois-Tacquet,"Anaïs Demoustier,Valeria Bruni Tedeschi,Denis Podalydès,Jean-Charles Clichet,Xavier Guelfi,Christophe Montenez,Annie Mercier,Anne Canovas,Bruno Todeschini,Grégoire Oestermann,Marie-Armelle Deguy,Eric Hervé",Nicola Piovani,"Anaïs a trente ans et pas assez d’argent. Elle a un amoureux qu’elle n’est plus sûre d’aimer. Elle rencontre Daniel, à qui tout de suite elle plaît. Mais Daniel vit avec Émilie… qu",https://fr.web.img2.acsta.net/c_310_420/pictures/21/07/12/16/10/4577226.jpg,https://www.allocine.fr/film/fichefilm-280205/critiques/spectateurs/,https://www.allocine.fr/film/fichefilm-280205/similaire/
Sentinelle,Sentinelle,5 mars 2021,1h 20min,"Action,Thriller","France,Belgique","1,6",687,119,Julien Leclercq,"Olga Kurylenko,Marilyn Lima,Michel Nabokov,Martin Swabey,Carole Weyers,Andrey Gorlenko,Gabriel Almaer,Blaise Afonso,Guillaume Duhesme,Michel Biel,Antonia Malinova,Erico Salamone",,"Klara qui a trente-trois ans. Elle est interprète dans l’Armée Française. Après avoir connu les horreurs de la guerre en Syrie, elle est mutée à Nice au sein de l’Opération Sentine",https://fr.web.img6.acsta.net/c_310_420/pictures/21/02/18/10/52/3563322.jpg,https://www.allocine.fr/film/fichefilm-280537/critiques/spectateurs/,https://www.allocine.fr/film/fichefilm-280537/similaire/
La Grâce,Blazh,24 janvier 2024,1h 59min,Drame,Russie,"3,0",179,41,Ilya Povolotsky,"Maria Lukyanova,Gela Chitava,Eldar Safikanov,Ksenia Kutepova,Aleksandr Cherednik,Semen Shteinberg",Zurkas Tepla,Un père et sa fille adolescente sillonnent la Russie à bord d’un van qui contient tous leurs biens et le matériel d’un cinéma itinérant. Ils organisent des projections en plein air,https://fr.web.img2.acsta.net/c_310_420/pictures/24/01/05/14/30/5951644.jpg,https://www.allocine.fr/film/fichefilm-315396/critiques/spectateurs/,https://www.allocine.fr/film/fichefilm-315396/similaire/
Comment je suis devenu super-héros,Comment je suis devenu super-héros,9 juillet 2021,1h 37min,"Action,Aventure,Drame,Fantastique,Science Fiction","France,Belgique","2,8",2296,236,Douglas Attal,"Pio Marmaï,Leïla Bekhti,Vimala Pons,Benoît Poelvoorde,Swann Arlaud,Léonie Souchaud,Gilles Cohen,Camille Japy,Louis Peres,Théo Christine,Clovis Cornillac,Elodie Rouprêt,Cartman,Cyril Gueï,Valentin du Peuty,Vincent Haquin,Adil Dehbi,Hubert Saint-Macary,Antoine Gouy","Nino Vella,Adrien Prevost","Paris 2020. Dans une société où les surhommes sont banalisés et parfaitement intégrés, une mystérieuse substance procurant des super-pouvoirs à ceux qui n’en ont pas se répand. Fac",https://fr.web.img4.acsta.net/c_310_420/pictures/21/06/17/12/24/2379588.jpg,https://www.allocine.fr/film/fichefilm-242126/critiques/spectateurs/,https://www.allocine.fr/film/fichefilm-242126/similaire/
On est fait pour s’entendre,On est fait pour s’entendre,17 novembre 2021,1h 34min,"Comédie,Romance",France,"3,6",2739,256,Pascal Elbé,"Sandrine Kiberlain,Pascal Elbé,Valérie Donzelli,Emmanuelle Devos,François Berléand,Marthe Villalonga,Claudia Tagbo,Manon Lemoine,Anne Azoulay,Antoine Gouy,Frédéric Merlo,Bérangère McNeese,Julia Faure,Atmen Kélif,Nicolas Vaude,Philippe Uchan,Patrice Abbou,Anabel Lopez,Emmanuelle Lepoutre,Jacky Nercessian,Quitterie Picamoles,Najim Zeghoudi",Christophe Minck,"Antoine semble n’écouter rien ni personne : ses élèves (qui lui réclament plus d’attention), ses collègues (qui n’aiment pas son manque de concentration), ses amours (qui lui repro",https://fr.web.img6.acsta.net/c_310_420/pictures/21/10/12/10/55/0748351.jpg,https://www.allocine.fr/film/fichefilm-281941/critiques/spectateurs/,https://www.allocine.fr/film/fichefilm-281941/similaire/
Le Passager nº4,Stowaway,22 avril 2021,1h 56min,"Drame,Science Fiction,Thriller","U.S.A.,Allemagne","2,1",1357,243,Joe Penna,"Anna Kendrick,Toni Collette,Daniel Dae Kim,Shamier Anderson",Volker Bertelmann,Un passager clandestin est découvert au sein d'un vaisseau spatial en direction de la planète Mars. L'équipage se trouve trop loin de la Terre pour faire demi-tour et il n'y a pas ,https://fr.web.img2.acsta.net/c_310_420/pictures/21/03/25/10/10/1179834.jpg,https://www.allocine.fr/film/fichefilm-269117/critiques/spectateurs/,https://www.allocine.fr/film/fichefilm-269117/similaire/
